{
  "protocol": "oebp",
  "version": "0.1.0",
  "kind": "PredicateExpression",
  "metadata": {
    "id": "org.oebp.fixtures.predicate.compare",
    "revision": "1.0.0",
    "created_at": "2026-06-16T09:00:00Z"
  },
  "spec": {
    "op": "compare",
    "left": "$object.mass_kg",
    "operator": "lt",
    "right": 1.0
  }
}
