{
  "protocol": "oebp",
  "version": "0.1.0",
  "kind": "PredicateExpression",
  "metadata": {
    "id": "org.oebp.fixtures.predicate.all",
    "revision": "1.0.0",
    "created_at": "2026-06-16T09:00:00Z"
  },
  "spec": {
    "op": "all",
    "args": [
      {
        "op": "exists",
        "path": "$object"
      },
      {
        "op": "predicate",
        "name": "oebp.state.ready",
        "subject": "$robot"
      }
    ]
  }
}
